"Product Name","Brand","Short Description","product ID","Description","Deeplink","image_URL","Price","Category","In Stock","top sellers"
"Medix Nebuliser 2-PIN Mains Lead (UK) 3605656","Clement Clarke","For use with Medix nebulisers","765","UK 2-PIN Mains lead for Medix Nebulisers such as the most recent models of World TravellerPart code: 3605656Please check your nebuliser has 2 metal pins to attach the lead to. If your nebuliser has 3 pins you will need a different part (number 3605622)","http://www.healthcare4all.co.uk/Nebuliser+Accessories/Medix+Nebuliser+2-PIN+Mains+Lead+%28UK%29+3605656.html","http://www.healthcare4all.co.uk/images/Mains_Lead_3605622_sm.jpg","9.95","Nebuliser Accessories","Y","415"
"Respironics Threshold IMT Lung Muscle Trainer","Philips","Designed to improve lung muscle endurance & strength","766","The IMT is designed to exercise your inspiratory muscles and is used by inhaling via the device at a pre-set pressure. The resistance provided by the valve enables the strengthening of the respiratory muscles.Flow-independent one-way valveConstant pressure (regardless of patient's airflow) eliminates the need for a pressure indicatorEasy to set, truly adjustable pressure (in 2 cm H2O increments)Effective therapy when held in any positionCan be used with mouthpiece or maskEasy to cleanMade of durable, high-impact acrylic materialIncreases respiratory muscle strength Increases respiratory muscle enduranceIncreases exercise tolerance","http://www.healthcare4all.co.uk/Asthma+%252526+Allergy/Lung+Devices/Respironics+Threshold+IMT+Lung+Muscle+Trainer.html","http://www.healthcare4all.co.uk/images/Respironics_Threshold_IMT_sm.jpg","17.94","Lung Devices","Y","416"
"Respironics Threshold PEP Expiratory Lung Clearer","Philips","Suitable for airway mucus clearance","767","Threshold PEP is used for airway clearance, bronchial hygiene, or as an alternative to chest physical therapy.  Threshold PEP incorporates a flow-independent one-way valve to ensure consistent resistance with adjustable specific pressure settings(in cm H20) which are set by the healthcare professional.  When patients breathe out through Threshold PEP, the resistive load creates positive pressure that helps open the airways and allows mucus to be expelled during “huff” coughing (forced expiratory technique).Flow-independent one-way valveConstant pressure (regardless of patient’s airflow) eliminates the need for a pressure indicatorEasy to set, truly adjustable pressure (in 1 cm H2O increments)Effective therapy when held in any positionCan be used with mouthpiece or maskEasy to cleanMade of durable, high-impact acrylicImproves mobilization and prevents accumulation of secretionsPromotes effective breathing patterns and improves gas exchangeImproves central and peripheral airway functionPrevents or reverses atelectasisOptimizes bronchodilation when combined with respiratory drug delivery via nebulizer or MDI spacer devices","http://www.healthcare4all.co.uk/Asthma+%252526+Allergy/Lung+Devices/Respironics+Threshold+PEP+Expiratory+Lung+Clearer.html","http://www.healthcare4all.co.uk/images/Respironics_Threshold_PEP_sm.jpg","17.94","Lung Devices","Y","417"
"ChoiceMMed MD100P10 Pen Style Mini ECG Monitor","ChoiceMed","Mini pen size ECG monitor for use on the go","768","Handheld ECG Monitor MD100P10 is designed for busy patients ‘on the go’ who have minor concerns about their heart and who wish to monitor their ECG trace. The traces can be replayed or printed out on a PC to provide ECG data to a doctor or specialist which could be useful to assist in diagnosis and treatment of a heart condition. As there is no complex set up, and the unit is small enough to fit in a pocket, it can be quickly switched on to collect ECG data the instant a problem is suspected. This may detect conditions before they become serious.We also stock the MD100E Colour handheld ECG monitor which enables you to collect a far more comprehensive ECG data record and it also features a comprehensive heart condition analysis feature. It additionally includes ECG electrodes and chest wires to allow optional chest monitoring for better readings.Please click here for more information on the MD100E.Features:Small, portable and easy to operate Completely cable free during operationMeasurement, recording and deletion of ECG and HR (heart rate)Two measuring modes selectable Transmit data to management software by USB cable (included)Fast measurement in just 30 seconds 20 records of heart rates, and data analysisOrganic Light Emitting Display (OLED) screen Display size: 2.5cm x 1.3cmAuto power-off Self-analysis of heart conditionOperating time (on fully charged battery): 2 hours Dimension and Weight:130mm (L) x 30mm (W) x 20mm (H) 110g (without battery&#65289;  Included:Batteries (2xAAA)Instruction manualQuick Operation GuideWarranty cardUSB cableData Management softwareSafety Data:Meet the requirements of IEC60601 serials standards, CE marking according to MDD93/42/EEC Technical Specification:Sampling Rate 250Hz Measuring Range 30bpm - 240bpm ECG Bandwidth 1Hz - 40Hz Measuring accuracy 30 - 100bpm: ±2bpm 101 - 240bpm: ±4bpmOperating environment The operating environment should comply with the following conditions: Operating Temperature: 5&#8451;&#65374;40&#8451; Relative Humidity: &#8804;80%,non-condensing Atmospheric pressure: 80kPa&#65374;106kPa The transport and storage environment should comply with the following conditions: Storage Temperature: -20&#8451;&#65374;55&#8451; Relative Humidity: &#8804;93%, non-condensing Atmospheric pressure: 50kPa&#65374;106kPa","http://www.healthcare4all.co.uk/ECG+Monitors/ChoiceMMed+MD100P10+Pen+Style+Mini+ECG+Monitor.html","http://www.healthcare4all.co.uk/images/ChoiceMed_Mini_Pen_ECG_Monitor_MD100P10_sm.JPG","149.99","ECG Monitors","Y","418"
"ChoiceMed MD300W1 Wrist Watch Pulse Oximeter","ChoiceMed","Wrist monitor suited to sleep study (such as apneoa)","769","MD300W1 is one kind of professional sleep recorder and intended for wrist measurement. It not only has high-resolution and non-volatile memory but also can accurately track tiny changes in one second. MD300W1 is special design to help people self-diagnose primarily screen the OSAS (obstructive sleep apnea syndrome).Application RangeAdult and PediatricSmall and portable designMeasuring mode: Real-timeStore the measured data and transfer to the computerUse software to analyse SpO2 and PR (pulse rate) conditionSet up to 10 ID codes, you can share it with yourfamilyEasy-to-read report can tell you whether you suffer fromthe OSAS (Obstructive Sleep Apnoea Syndrome) or notSave time waiting for clinic results!EnvironmentThe operating environment should comply with the following conditions:Operating Temperature: 5&#8451;&#65374;40&#8451;Relative Humidity: &#8804;80%,non-condensingThe transport and storage environment should comply with thefollowing conditions:Storage Temperature: -20&#8451;&#65374;50&#8451;Relative Humidity: &#8804;93%, non-condensingPower RequirementsPower Supply: DC 1.5V(1 AAA alkaline battery)Operating Time: 12 hours for continuous measuringDimension and WeightDimension&#65306; 60mm (L) x 50mm (W) x20mm (H)Weight&#65306; 26gDisplayType: LCDParameters: SpO2, PR, Pulse barDisplay Mode: 1 display modeSpO2Measurement range 70% - 100%Resolution 1%Measurement accuracy 80% - 100%: ±2%70% - 79%: ±3%0% - 69%: no definitionPulse RateMeasure range 30 - 235bpmResolution 1bpmMeasurement accuracy 30 - 100: ±2 bpm101 - 235: ±2%","http://www.healthcare4all.co.uk/Pulse+Oximeters/ChoiceMed+MD300W1+Wrist+Watch+Pulse+Oximeter.html","http://www.healthcare4all.co.uk/images/ChoiceMed_Oximeter_MD300W1_Wrist_sm.JPG","169.94","Pulse Oximeters","Y","419"
"ChoiceMed MD300M Handheld Colour Pulse Oximeter","ChoiceMed","Robust, feature packed and yet very easy to use with simple menu system","770","The MD300M is packed full of features, yet at the same time is very easy to use and you can select the features you need simply by using the up, down and select buttons.It is designed to be robust and can give you at-a-glance analysis of SpO2 and Pulse Rate, whether you need a table or instant graph review.It’s portable, compact and reliable and would be perfectly suited to a clinical environment, hospital use, medical first aid departments or serious home use.Features:High resolution large 2.8” TFT screen displays SpO2, PR, waveform and pulse bar Adjustable audible and visual alarms – Bright coloured alarm lamp on front of unit, separate from the screenVery easy to use menu system for adjusting settings and featuresBattery-low indicator Adjustable backlight and voiceAutomatic power-off functionLock function to prevent keys from being accidentally pressedRobust attachment for sensors to main unit, prevents accidental removal of cableBattery case lock prevents unauthorised removal of batteries Allows 127 different patient IDs72-hour data storage and reviewThe large built-in screen allows you to review the recent results as well as instantly view average SpO2 and PREven on-screen graphs are easy and clear to displayAudible alarm supression - can be silenced for 2 minutesMedView software for further data analysis on a PCBluetooth, charger stand and AC/DC adapter are optional 3 AA alkaline batteries Supplied with adult sensor probe but also suitable for paediatric and infant use – please see accessories for required sensors Technical Specification:SpO2 Measurement range 70% - 100% Resolution 1% Measurement Accuracy 70% - 100%: ±3 Digit 0% - 69%: no definition Pulse Rate Measurement range 30 - 235bpm Resolution 1bpm Measurement accuracy +2bpm or 2% (The larger) DisplayType 2.8” colour TFT Parameters SpO2, PR, pulse bar, PlethysmogramBrightness Adjustable 1 - 7 level Alarm FunctionsAlarm SpO2, PR, Probe off, Finger out Battery-low indicator Modes audio & visual alarm, information Data transmissionTransmission method USB Data cable ID setup 1 - 127 Data record 72 hours Dimensions and weight:125mm (L) x 60mm (W) x30mm (H) 195g (excluding the batteries) Power Supply:Type 3 x AA alkaline batteries (supplied) or 3 x AA Ni-Mh batteriesIf Ni-Mh batteries are used in conjunction with optional charger stand, the oximeter can be kept on charge while placed in standBattery operation time: 16 hours continuously (maximum) AC adapter Input Voltage: AC 100 - 240V Input Frequency: 47 - 63Hz Output Voltage: DC 5V±5% Output Current: 2A MAX Includes:3 x AA alkaline batteries;Instruction manualAdult finger probe, Model: M-50E; Key for fastening the case lockWrist strapSoftware CD containing MedView for PC installationUSB CableOptional accessories: Binding sensor for paediatric, infant and neonatal usePaediatric 15-45 Kg, Infant 3-15 Kg), Model: M-50C; Fingertip sensor for paediatric, Model: M-50B; Soft sensor for paediatric (Paediatric 15-45 Kg, Infant 3-15 Kg), Model: M-50HSoft sensor for adult, Model: M-50GCharger Stand (with adapter and USB Cable) ","http://www.healthcare4all.co.uk/Pulse+Oximeters/ChoiceMed+MD300M+Handheld+Colour+Pulse+Oximeter.html","http://www.healthcare4all.co.uk/images/ChoiceMed_Oximeter_MD300M_sm.JPG","249.00","Pulse Oximeters","Y","420"
"ChoiceMed Charger Stand for MD300M Pulse Oximeter","ChoiceMed","For use with MD300M pulse oximeter","771","Plugs into an AC mains supply or can be powered by USB connectorEnables recharging of NiMh batteries if used in ChoiceMMed MD300M pulse oximeterPower-on indicator","http://www.healthcare4all.co.uk/Pulse+Oximeters/ChoiceMed+Charger+Stand+for+MD300M+Pulse+Oximeter.html","http://www.healthcare4all.co.uk/images/ChoiceMed_Oximeter_MD300M_Stand_sm.jpg","39.95","Pulse Oximeters","Y","421"
"Adult Probe Oximeter Sensor for CMS50F","Other","Replacement adult probe","772","6-pin connection for attachment to CMS-50F pulse oximeterReusable probe, wipe clean","http://www.healthcare4all.co.uk/Pulse+Oximeters/Adult+Probe+Oximeter+Sensor+for+CMS50F.html","http://www.healthcare4all.co.uk/images/cms50f_fingertip_pulse_oximeter_sm.jpg","34.99","Pulse Oximeters","Y","422"
"Paediatric Soft Sensor M-50H Oximeter Probe for ChoiceMMed","ChoiceMed","Comfortable soft sensor for MD300M and I2 model","773","Designed to fit the ChoiceMMed MD300M pulse oximeterSuitable for children aged between 3 and 12 years oldLatex-free materialPart number M-50HCompatible with the following Choice oximeters:MD300K1, MD300K12, MD300K2, MD300K3, MD300M, MD300I, MD300I1, MD300I2, MB300WB, MD2000A, MD300B, MD300B-S, MD300A, MD300H, MD2000B","http://www.healthcare4all.co.uk/Pulse+Oximeters/Paediatric+Soft+Sensor+M-50H+Oximeter+Probe+for+ChoiceMMed.html","http://www.healthcare4all.co.uk/images/Paediatric sensor for MD300M_sm.JPG","34.99","Pulse Oximeters","Y","423"
"Infant Wrap Sensor Oximeter Probe M-50C for ChoiceMMed","ChoiceMed","Wrap-around soft sensor for MD300M and I2 model","774","Designed to fit the ChoiceMMed MD300M pulse oximeterSuitable for infants below 3 years oldLatex-free materialPart number M-50CCompatible with the following Choice oximeters:MD300K1, MD300K12, MD300K2, MD300K3, MD300M, MD300I, MD300I1, MD300I2, MB300WB, MD2000A, MD300B, MD300B-S, MD300A, MD300H, MD2000B","http://www.healthcare4all.co.uk/Pulse+Oximeters/Infant+Wrap+Sensor+Oximeter+Probe+M-50C+for+ChoiceMMed.html","http://www.healthcare4all.co.uk/images/Wrap sensor for MD300M_sm.jpg","34.99","Pulse Oximeters","Y","424"
"Blephasol Eyelid Hygiene Blepharitis Lotion 100ml","Other","For daily cleaning of sensitive eyelids e.g. in blepharitis","775","Blephasol is tested by dermatologists and recommended for daily cleaning of sensitive eyelids, especially the lid margins.It is made using a micelle formulation which ensures it is free from alcohol, detergents, and preservatives which can irritate the eyes.It removes impurities, stains, make-up and dried secretions from eyelids and the base of eyelashes without causing any irritation of the eye or surrounding skin.Ideal in the management of blepharitis (inflammation of the eyelid margin).Can be used twice a day on an ongoing basis without causing any harm.","http://www.healthcare4all.co.uk/Skincare/Blephasol+Eyelid+Hygiene+Blepharitis+Lotion+100ml.html","http://www.healthcare4all.co.uk/images/Blephasol_Lotion_100ml_sm.jpg","10.30","Skincare","Y","425"
"ChoiceMMed ECG Electrodes for MD100E Monitor (x10)","ChoiceMed","For use with 3-lead wires. Also compatible with other monitors","776","Pack of 10For use with ChoiceMMed MD100E ECG monitors - the 3-lead wire is also required to use these ECG monitors with electrode pads (wire available separately)Will also fit Prince 180A/180B and many other ECG Monitors","http://www.healthcare4all.co.uk/ECG+Monitors/ChoiceMMed+ECG+Electrodes+for+MD100E+Monitor+%28x10%29.html","http://www.healthcare4all.co.uk/images/Prince_Electrodes_sm.jpg","5.95","ECG Monitors","Y","426"
"Beurer IH50 Replacement Mesh Cap & Medicine Container 162.711","Beurer","Replacement for IH50 nebuliser","777","Replacement mesh cap and medicine container for Beurer IH50 NebuliserPart number 162.711","http://www.healthcare4all.co.uk/Nebuliser+Accessories/Beurer+IH50+Replacement+Mesh+Cap+%252526+Medicine+Container+162.711.html","http://www.healthcare4all.co.uk/images/Beurer_IH50_Mesh_Cap_sm.JPG","43.00","Nebuliser Accessories","Y","427"
"Panasonic Dentacare EW0925 Double-Edged Toothbrush Heads (x2)","Panasonic","Designed for DL40, EW1031 and EW1035","778","Double-edged brush properly fits the surface of the teeth and ensures plaque removal by easily reaching inter-dental spacesPack of 2 headsDesigned for the following Panasonic toothbrush models: EW-DL40, EW1031, EW1035","http://www.healthcare4all.co.uk/Dental+Hygiene/Accessories+%25252F+Refills/Panasonic+Dentacare+EW0925+Double-Edged+Toothbrush+Heads+%28x2%29.html","http://www.healthcare4all.co.uk/images/Panasonic-EW0925-Double Edged-Brush-Heads_sm.jpg","11.00","Accessories / Refills","Y","428"
"Beurer HK54 Shoulder & Neck Electric Heating Pad","Beurer","Soothing heat with a soft cosy surface","779","Soothing heat from this electric heating pad, with a soft cosy surface and form-fitted design to ensure a comfortable fit for the shoulders and neckThe pad is individually adjustable by press stud & magnet closure3 settings on temperature controllerIlluminated switch positionsControl unit can be detachedPad is machine washable at 30 degrees C100 watt power outputTimer function - powers off after 90 minutesElectronic temperature regulation for safety3 year guaranteeSize of heat pad: 56cm x 52cm","http://www.healthcare4all.co.uk/Therapy/Beurer+HK54+Shoulder+%252526+Neck+Electric+Heating+Pad.html","http://www.healthcare4all.co.uk/images/Beurer-HK54-Neck-Shoulder-Heat-Pad_sm.jpg","53.99","Therapy","Y","429"
"Wrist Watch Finger Pulse Oximeter CMS50FW Bluetooth Wireless","Other","Featuring bluetooth transmission of data","780","The CMS-50FW wearable wrist watch pulse oximeter is excellent for taking or monitoring continual readings of oxygen saturations (sats) and pulse rate. The design makes it ideal for sleep studies (e.g. in the monitoring of sleep apnoea).The FW model features wireless bluetooth transmission to your computer, enabling instant readings while the oximeter is being worn, and also data upload by bluetooth.With a rechargeable lithium ion battery, 24 hours of data storage and all the necessary cables and software, the CMS-50FW is an excellent package.Features:CMS-50FW Bluetooth Wrist Pulse OximeterWearable Digital Pulse Oximeter Worn comfortably on the patients wrist for easy spot-check of blood oxygen saturation and pulse rate.Can be used for monitoring daily activities and overnight sleep studies.Display automatically switches off in long term record mode so that the device does not disturb your sleep.The compact design is intended to give the patient greater freedom while improving patient compliance.Compact and light weight design, fit comfortably on the patients wristSimply plug the sensor in and out - the sensors can be replacedOptional infant and paediatric sensors available from stockReplacement adult sensors also availableNew USB connector for sensor increases durabilitySilicon strap design (improved from 50F)Clock/watch functionFor spot checking short and long term monitoring applicationsHigh accuracyBluetooth data transmission - includes transmitter. Note: you will need a computer capable of receiving bluetooth signal (e.g. modern laptops) or a bluetooth receiver dongle (please enquire for more information)Easy-to-use operation menu for setting functions256k color OLED display with 4 directionsPulse strength: OLED Graphic displayBattery voltage indication: OLED graphic displayPlethysmograph Wave to assist in obtaining a strong readingCan be used in high altitudes, at high & low temperaturesBuilt-in Alarms for SPO2 and Pulse Rate - these can be configured with minimum and maximum valuesBuilt-in Memory for up to 24hrs of Data StorageIdeal for Doctors, Home Health Care, Clinics, HospitalsAlso can be used for Aviation, Sports, Mountain Climbers, WalkersSuperior Colour OLED Screen with Multi-Directional ViewsBrightness Adjustment for Viewing in any LightBuilt-in Rechargeable Lithium Ion Battery CellCE certifiedIncluded in package:USB Cable for computer downloadIncludes SpO2 monitoring trend software - compatible with Windows XP, Windows Vista, Windows 7 (32-bit and 64-bit)Can also run on Apple Mac operating system using Parallels (as tested by our customers).Inner flash memory for data storageWatch/oximeter unit with strapFinger sensor probe for adults (infant and paediatric sensors as optional extras)Power supply:3.7V rechargeable Lithium battery and a mains charger with USB interface - can charge from mains or USBInput voltage: 100 - 240v AC - 50/60HzDimensions:61 (L) x 56 (W) x 24 (H) mmWeight: approximately 50g with lithium battery","http://www.healthcare4all.co.uk/Pulse+Oximeters/Wrist+Watch+Finger+Pulse+Oximeter+CMS50FW+Bluetooth+Wireless.html","http://www.healthcare4all.co.uk/images/cms50fw_WIRELESS_fingertip_pulse_oximeter copy_sm.jpg","179.99","Pulse Oximeters","Y","430"
"Beurer HK125 XXL Large Cosy Electric Heating Pad","Beurer","New cosy version of extra large heat pad","781","Soft, comfortable heating pad made of cosy micro-fibre coverSkin-friendly fabricExtra-large giant heating pad approx. 60 x 40 cmImproved innovative button switch with LED lightsDetachable control unitCover is machine-washable at 30 °CSafety BSS overheating protection6 temperature settingsIlluminated function displayAutomatic switch-off function after approx. 90 minutesFast heatingPower: 100 watt3 year guarantee","http://www.healthcare4all.co.uk/Therapy/Beurer+HK125+XXL+Large+Cosy+Electric+Heating+Pad.html","http://www.healthcare4all.co.uk/images/HK 125_sm.jpg","59.99","Therapy","Y","431"
"Beurer HK25 Electric Heating Pad","Beurer","3 heat settings, includes cotton cover","782","Features BSS overheat protection for safetyAuto switch-off function after approx. 90 minutesThe heating element is made from a wipeable plastic protective coverThe cotton cover is removable and washable3 adjustable temperature settingsElectronic temperature regulationIlluminated switch positionsSize of heat pad approx. 40 x 30 cmPower: 100 watt","http://www.healthcare4all.co.uk/Therapy/Beurer+HK25+Electric+Heating+Pad.html","http://www.healthcare4all.co.uk/images/Beurer-HK25-Heat-Pad_sm.jpg","29.99","Therapy","Y","432"
"Beurer HK65 Aromatherapy Electric Heating Pad","Beurer","Aromatic for relaxation or cold-relief","783","With 2 herb inserts for aromatic applications:-Relaxation insert (aniseed, thyme, peppermint)-Cold-relief insert (lavender, lemon balm, melissa)Removable skin-friendly aloe vera coverBreathable, cosy and skinfriendlyHerb insert refills are availableDetachable control unitCover is machine-washable at 30 °CTurbo heatingSafety BSS overheating protectionAutomatic switch-off function after approx. 90 minutesElectronic temperature control3 illuminated temperature settingsHeat Pad size: 33 x 44 cmPower: 100 watt","http://www.healthcare4all.co.uk/Therapy/Beurer+HK65+Aromatherapy+Electric+Heating+Pad.html","http://www.healthcare4all.co.uk/images/Beurer-HK65-Aroma-Heat-Pad_sm.jpg","59.99","Therapy","Y","433"
"Heal Force Prince 100F High-Resolution Handheld Pulse Oximeter","Heal Force","Infant or paediatric sensor probes also available","784","The Prince 100F handheld pulse oximeter is a portable device for monitoring SpO2, pulse rate and pulse strength. It is robust, fast and reliable, so the device is suitable for use both at home and in a hospital environment.It is an upgraded model of the 100E, the main differences being as follows:High-resolution LCD dot-matrix display - for graphical display of resultsPlethysmogram display of SpO270 hours of data storagePerfusion Index (PI) displayHandheld size with detachable probesSupplied with 1 x adult probe but we also have infant and paediatric probes in stockHigh resolution monochrome LCD display enables display of plethysmogram and measured dataSwitchable backlight on displayAccurate measurement of SpO2 and Pulse rate with anti-motion technologyPerfusion Index (PI) displayReal time pulse bar displayBeep alarm for abnormal readings with adjustable limits (can be configured by user)Also has a Visual alarm70 hours data storage and reviewDate and time functionMute function - suitable for use during sleep apnoea measurementAutomatic power-off after finger outOptional PC data management software for data transmission and analysis (software/cable available as an accessory)Operates on 3 x AA battery (supplied) with power management and battery indicatorCan also be used with NiMh rechargeable batteries (optional)CE markedIncludes metal stand with rubber feet to hold unit while in useDimensions:145mm (L) x 74mm (W) x 29mm (H)Weight:210g (excluding batteries and accessories)Continuous working time:Over 30 hours","http://www.healthcare4all.co.uk/Pulse+Oximeters/Heal+Force+Prince+100F+High-Resolution+Handheld+Pulse+Oximeter.html","http://www.healthcare4all.co.uk/images/Prince_100F_Pulse_Oximeter_sm.jpg","199.00","Pulse Oximeters","Y","434"
"Medisana WBW Reflexology Foot Spa","Medisana","Can be used wet or dry","785","Relaxing dry or wet foot massageBubble and dry massage: Level 1 = massage Level 2 = massage + heat + bubblesIncludes massage rollers and massage ballsHigh-definition massage: selective, intensive massage to make you feel goodIntensive reflexology","http://www.healthcare4all.co.uk/Therapy/Medisana+WBW+Reflexology+Foot+Spa.html","http://www.healthcare4all.co.uk/images/Medisana-WBW-Foot-Spa_sm.jpg","39.96","Therapy","Y","435"
"Medisana EPD Electronic Hair Removal System","Medisana","For Permanent Hair Removal","786","Normal epilators capture hair in their rotating rollers, similar to small tweezers, pulling out the fine hairs. The effect lasts for up to four weeks.The permanent removal of hair using this EPD system goes one step further. A gentle electrical impulse is transmitted from the electrodes, corroding the growth cells in the hair roots. The hair is gradually destroyed. The hairs are then pulled out and you are free of disturbing hair for a long period of time.Special electrodes for the different regions of the body are included with the device. This means that you can use this pain-free method everywhere you would like to!Suitable for men and womenSimple to usePain-freeUses electrolysis for permanent hair root destructionLCD displayBattery operated (4 x AA batteries included)Electrodes included:2 x (30 x 50mm)2 x (50 x 90mm)2 x (14 x 52mm)Detailed manual with placement guide in 15 languagesProgramme duration 9-10 mins/programme12 programmes (1-8 for male users, 9-10 for female users)Operating current 40-200 mA3 year guarantee","http://www.healthcare4all.co.uk/Ladies+Hair+Removal/Medisana+EPD+Electronic+Hair+Removal+System.html","http://www.healthcare4all.co.uk/images/Medisana_EPD_Hair_Removal_System_sm.jpg","99.90","Ladies Hair Removal","Y","436"
