"Product Name","Brand","Short Description","product ID","Description","Deeplink","image_URL","Price","Category","In Stock","top sellers"
"Prima Home Test Bowel FOB Tester (Faecal Occult Blood)","Prima","Home test - to detect blood in faeces","944","COLORECTAL FOB Test (Faecal occult blood)  Check the presence of occult blood in faeces to verify possible gastrointestinal disorders.  INDICATED FOR Men and women from 45 to 75 years-old   WHY SHOULD I PERFORM THE TEST? Gastrointestinal disorders often bleed. The blood can be detected specifically by the faeces test. The presence of blood can be justified by benign causes; for example, ulcers, hemorrhoids, polyps, or fissures. It could also be due to a malignant pathology such as colorectal cancer.  Checking the presence of blood in the faeces is a very good tool for verifying health status and eventually taking the required preventive actions. In case of cancer, early detection and prevention can be life saving.  HOW DOES IT WORK?  The test is based on a new generation immunological methodology with high sensitivity which doesn’t require any dietary restrictions before or during the test. 1) Collect the samples using the special collection paper which allows you to do it with comfort and hygiene. 2) Use the stick of the collection tube and collect the sample three times in three different days. 3) The sample is closed inside the tube. 4) Add the diluent, wait for 10 minutes and read the result.  CONTENT: 1 sealed aluminum pouch containing: 1 test device and desiccant, 3 paper faecal sample collection strips,1 tube containing 2 ml of extraction solution in a protective plastic bag, and instructions for use.","http://www.healthcare4all.co.uk/Diagnostic+Equipment/Prima+Home+Test+Bowel+FOB+Tester+%28Faecal+Occult+Blood%29.html","http://www.healthcare4all.co.uk/images/pack_colon_Test_FOB_sm.jpg","13.80","Diagnostic Equipment","Y","577"
"Prima Home Test Helicobacter Pylori Stomach Tester","Prima","Can help determine if illness-causing bacteria are present","945","GASTRIC DISORDER PREVENTION  HELICOBACTER PYLORI TEST Check the presence of an infection caused by the Helicobacter pylori bacterium. The antibodies against Helicobacter pylori are usually absent in people who have never contracted that infection.  INDICATED FOR: All of us.  WHY SHOULD I PERFORM THE TEST? The bacterium Helicobacter pylori grows in the gastric mucosa, where it can damage it to the point of causing stomach ulcers. The associated disturbances are gastritis and burning sensation in the stomach, even if more than 50% of the infections are without symptoms. This infection can be treated easily with specific antibiotics (which are prescribed by your doctor).  Checking the presence of antibodies against Helicobacter pylori is a very good tool for verifying our own health status and eventually taking the required preventive actions. In fact, an untreated infection can increase the probability of developing stomach cancer.  HOW DOES IT WORK?  The test works by using an immunology reaction that verifies the presence of specific antibodies against Helicobacter pylori. 1) The sample is a blood drop taken with the painless sterile lancet contained in the box. 2) Obtain a big drop of blood by squeezing the finger. 3) Put the drop of blood on the indicated point on the device. 4) Add the diluent, wait for 10 minutes and read the result.  CONTENT: 1 sealed aluminum pouch containing: 1 device for the test and desiccant, 1 dropper vial containing 0.5 ml of diluent, 1 painless sterile lancet for blood sampling, instructions for use.","http://www.healthcare4all.co.uk/Diagnostic+Equipment/Prima+Home+Test+Helicobacter+Pylori+Stomach+Tester.html","http://www.healthcare4all.co.uk/images/pack_Helicobacter_Pylori_home_test_sm.jpg","13.80","Diagnostic Equipment","Y","578"
"Prima Home Test Allergy Tester","Prima","Suitable for ages over 15 years","946","Individuals with allergic sensitivity to various substances such as pollens, animal hairs, feathers or some foods, have abnormally high levels of IgE (Immunoglobulin E) antibodies. That sensitivity can be developed in different moments of life, but can affect children, adolescents, and adults.  With this allergy test, you can assess IgE levels in the blood and detect any allergy sensitivity. The test should be performed in the case of symptoms that can be associated with the allergy, such as rashes and redness on the skin, tears or repetitive sneezing when in the presence of dust or in contact with animals (dog, cat, etc), or the appearance of oedema (swelling) after ingesting particular food. The test can be performed at any time, but not in subjects younger than 15 years, as the test sensitivity was adjusted on an adult population. CE Certified by Notified Body n°0483.  The main symptoms of allergy are redness on the skin, rash, tears, repetitive sneezing and swelling. These symptoms can be mixed up with the usual signs of viral and bacterial infections such as flu, cold and a bacterial sore throat. That is why it is important to check if the IgE level is abnormally high in these cases or in subjects who have a family history of allergy. Through determining an immunoglobulin E level higher than average, the doctor can direct to a more specific search for substances causing allergic symptoms and can define a therapy adapted to the patient.","http://www.healthcare4all.co.uk/Diagnostic+Equipment/Prima+Home+Test+Allergy+Tester.html","http://www.healthcare4all.co.uk/images/pack_Allergy_home_test_sm.jpg","13.80","Diagnostic Equipment","Y","579"
"Prima Multicare-In Cholesterol Test Strips (25 pk)","Prima","For use with Multicare-In meter","949","For a healthy lifestyle check and monitor your cardiovascular risk regularly 25 Cholesterol Test Strips for use with MULTICARE IN meter  Pack also ncludes the chip for the MULTICARE IN meter  After performing the finger prick apply the blood directly on the strip Very clean and hygienic - blood drops do not touch the meter      MultiCare-In cholesterol reagent strips kit for the determination of cholesterol concentration in blood.  The level of cholesterol in the blood is influenced by the diet, but also by: medicines, diabetes mellitus, pregnancy and severe illnesses. It is recommended to check blood cholesterol concentration on all people who used to smoke, drink too much alcohol and eat fat and are over weight or do not exercise enough.The level of cholesterol in the blood is strictly correlated to the cardiovascular risk. Values above 5.1 mmol/L (200 mg/dL) are considered high risk. The measuring range is: 3.3 - 10.2 mmol/L (130 – 400 mg/dL).  Pack of 25 test strips and 1 data chip","http://www.healthcare4all.co.uk/Diagnostic+Equipment/Prima+Multicare-In+Cholesterol+Test+Strips+%2825+pk%29.html","http://www.healthcare4all.co.uk/images/Multicare_cholesterol_25_sm.jpg","54.96","Diagnostic Equipment","Y","580"
"Piko Replacement Mouthpieces (x10)","nSpire","For Piko-1 and Piko-6","950","Pack of 10 clear replacement mouthpieces for Piko-1 and Piko-6","http://www.healthcare4all.co.uk/Asthma+%252526+Allergy/Peak+Flow+Meters/Piko+Replacement+Mouthpieces+%28x10%29.html","http://www.healthcare4all.co.uk/images/piko-plastic-mouthpiece-393535_sm.jpg","8.39","Peak Flow Meters","Y","581"
"Medisana Manilux L Manicure & Pedicure Unit with Light + 10 Accs","Medisana","Features complete set of attachments","951","Care and treatment of nails, cuticles, corns and calluses Integrated lighting for precise and comfortable use Variable speed control Mains powered- UK 3-pin fitted plug which can be removed to reveal 2-pin European Plug Clockwise and anti-clockwise rotation for easy nail treatment With 10 attachments - 9 sapphire attachments and 1 felt polishing cone Storage case for unit and attachments Due to the minimal risk of injury, the Manilux is also especially suitable for use by diabetics or older people. Rotation speed 1800 - 11000 rpm","http://www.healthcare4all.co.uk/Beauty/Medisana+Manilux+L+Manicure+%252526+Pedicure+Unit+with+Light+%25252B+10+Accs.html","http://www.healthcare4all.co.uk/images/Medisana-Manilux-L-85404_sm.jpg","79.98","Beauty","Y","582"
"Respironics SideStream Plus Reusable Nebuliser Kit with Hose","Respironics (Philips)","HOSE VERSION: Fast and efficient drug delivery","952","A breath-enhanced nebuliser for use with antibiotics and steroids.  You can rely on SideStream Plus to deliver fast and efficient aerosol drug delivery with less drug waste during exhalation.  The low resistance valve is ideal for weaker-breathing users, including paediatric and elderly patients - the valve opens on inspiration to boost medication availability and closes on exhalation, preserving medication and reducing waste.  SideStream Plus is suitable for nebulising all commonly prescribed aerosol therapy medications, including bronchodilators (such as salbutamol), antibiotics and steroids.  Our optional durable filter attachment (with disposable filter pads), or the included aerosol hose, easily attach to SideStream Plus to help protect others from breathing in unnecessary medication; this is particularly important when nebulising antibiotics.  Fast treatments in under five minutes Efficient performance with reduced waste Reusable for up to 12 months  This pack contains: SideStream Plus handset Valved mouthpiece Non-valved mouthpiece Air supply tubing Valved tee piece Aerosol hose (1m)Note: if a mask is required for nebuliser treatment, replace the mouthpiece with a sealing mask, and ensure a valved tee piece is connected to the sealing maskAlso, SideStream Plus requires a compressor driving flow of at least 3.5 l/min - suitable for use with the PortaNeb and Inspiration Elite.","http://www.healthcare4all.co.uk/Nebuliser+Accessories/Respironics+SideStream+Plus+Reusable+Nebuliser+Kit+with+Hose.html","http://www.healthcare4all.co.uk/images/Sidestream_Plus_With_Hose_1092003_sm.jpg","33.60","Nebuliser Accessories","Y","583"
"Respironics SideStream Plus Reusable Nebuliser Kit with Filters","Respironics (Philips)","FILTER VERSION: fast and efficient delivery of medication","953","A breath-enhanced nebuliser for use with antibiotics and steroids.  You can rely on SideStream Plus to deliver fast and efficient aerosol drug delivery with less drug waste during exhalation.  The low resistance valve is ideal for weaker-breathing users, including paediatric and elderly patients - the valve opens on inspiration to boost medication availability and closes on exhalation, preserving medication and reducing waste.  SideStream Plus is suitable for nebulising all commonly prescribed aerosol therapy medications, including bronchodilators, antibiotics and steroids.  Our included durable filter attachment (with disposable filter pads), or the optional aerosol hose, easily attach to SideStream Plus to help protect others from breathing in unnecessary medication; particularly important when nebulising antibiotics.  Fast treatments in under five minutes Efficient performance with reduced waste Reusable for up to 12 months  This pack contains: SideStream Plus handset Valved mouthpiece Non-valved mouthpiece Air supply tubing Valved tee piece Expiratory filter holder Expiratory filter pads (x10)  Note: if a mask is required for nebuliser treatment, replace the mouthpiece with a sealing mask, and ensure a valved tee piece is connected to the sealing maskAlso, SideStream Plus requires a compressor driving flow of at least 3.5 l/min - suitable for use with the PortaNeb and Inspiration Elite.","http://www.healthcare4all.co.uk/Nebuliser+Accessories/Respironics+SideStream+Plus+Reusable+Nebuliser+Kit+with+Filters.html","http://www.healthcare4all.co.uk/images/Sidestream_Plus_With_Filters_1091999_sm.jpg","34.80","Nebuliser Accessories","Y","584"
"Omron M2 Classic Digital Blood Pressure Monitor","Omron","Now with 21 reading memory","954","The clinically validated, yet inexpensive Omron M2 Classic Upper Arm Digital Blood Pressure Monitor features Omron's Intellisense technology and simple one-button operation.  An irregular heartbeat indicator means the device is capable of identifying possible arrhythmia.  The unit has a clear LCD display featuring large digits making it ideal for use by patients or health professionals.  The M2 Classic has an internal memory for the last 21 recorded measurements.    Features Single button operation Irregular heartbeat indicator 21 reading memory with recall button Electrical inflation with Intellisense Clear LCD display Requires 4 AAA batteries (supplied) Supplied with medium adult cuff (fits 22-32cm)   Technical Data Measurement method: Oscillometric Blood pressure range: 0 - 299mmHg (±3mmHg) Pulse range: 40 - 180 bpm (±5%) Dimensions: 104 x 81 x 129mm (W x H x L) Weight: 260g (without batteries)","http://www.healthcare4all.co.uk/Blood+Pressure/Omron/Omron+M2+Classic+Digital+Blood+Pressure+Monitor.html","http://www.healthcare4all.co.uk/images/Omron_M2_Classic_sm.jpg","29.88","Omron","Y","585"
"Prima Home Test Iron Anaemia Test FERRITIN Tester","Prima","Results in 10 minutes","955","Check the level of Ferritin – FER – in blood to verify the iron stores.  INDICATED FOR The FER screening should be performed by all the pregnant women and regularly by all anaemic people with healthy lifestyle.  WHY SHOULD I PERFORM THE TEST? The Ferritin level in blood is useful in detecting iron store depletion as the concentration drops to very low values. As iron deficiency develops, iron stores are depleted before anaemia becomes apparent.  Checking the normality of the FER value is a very good tool for verifying the iron deficiency anaemia and eventually taking the required preventive actions.  HOW DOES IT WORK? The test is based on an immunochromatographic reaction correlated to the reference laboratory test. The cut-off is calibrated at 20 ng/mL according to the international standard. 1) The sample is a blood drop taken with the painless sterile lancet contained in the box. 2) Obtain a big drop of blood by squeezing the finger. 3) Put the drop of blood on the indicated point on the device. 4) Add the diluent, wait for 10 minutes and read the result.  CONTENT 1 test device, 1 pipette and desiccant, 1 dropper vial containing 1 ml of diluent, 1 painless sterile lancet for blood sampling, instructions for use","http://www.healthcare4all.co.uk/Diagnostic+Equipment/Prima+Home+Test+Iron+Anaemia+Test+FERRITIN+Tester.html","http://www.healthcare4all.co.uk/images/pack_iron_home_test_sm.jpg","13.80","Diagnostic Equipment","Y","586"
"Prima Home Test Albumin Protein KIDNEY Tester","Prima","Home test - results in 5 minutes","956","KIDNEY ALBUMIN TEST  Check the concentration of albumin in the urine to verify alterations in kidney function.  INDICATED FOR All of us.  WHY SHOULD I PERFORM THE TEST? A high albumin level reflects dysfunction of the kidneys’ filtering function. The kidneys filter blood to remove impurities: small composites are discharged while proteins, which are bigger, are retained by kidneys. Albumin is one of those proteins that should be retained by kidneys. If the kidneys work properly, the concentration of albumin is zero or less than 10 mg/dl. Concentration of glucose or triglycerides, diabetes or hypertension are factors that promote the concentration of albumin in urine.  Checking the presence of albumin in the urine is a very good tool for verifying our own health status and eventually take the required preventive actions.  HOW DOES IT WORK? The Test works by pointing out the concentration of albumin in the urine as normal or above the normal value. 1) The sample is the first urine of the day collected in a clean cup contained in the box. 2) Take the strip-test from the grip side. 3) Dip the strip-test for few seconds. 4) Wait for 5 minutes and read the result.  CONTENT 1 sealed aluminum pouch containing: 1 strip-test and desiccant, 1 urine cup, instruction for use.","http://www.healthcare4all.co.uk/Diagnostic+Equipment/Prima+Home+Test+Albumin+Protein+KIDNEY+Tester.html","http://www.healthcare4all.co.uk/images/pack_albumin_kidneys_home_test_sm.jpg","13.80","Diagnostic Equipment","Y","587"
"Noppy Bed-Wetting Enuresis Alarm","Other","It really works!","957","Bedwetting Your child is certainly not the only one! A child's toilet training develops during the first years of life when children start to become aware of the urge to urinate. The child must still learn to hold up their urine at night or waking up to the sensation of a full bladder. When a child still wets their bed beyond the age of pre-school and there is no medical reason to justify this, the child suffers from bedwetting.  Training using a bedwetting alarm A bedwetting alarm teaches the child to wake up to the sensation of a full bladder. The alarm immediately sounds an alarm tone when the child loses a few drops of urine. The alarm will then be switched off and the child can finish urinating on the toilet. Through this therapy, the child learns to associate the sensation of a full bladder with having to wake up.  How will this proceed? In time the child will wake up on its own without having to depend on the alarm tone. When the child remains dry for fourteen nights in a row, the bedwetting alarm is not needed anymore. Even when the bedwetting alarm has not been used and the child still manages to keep dry, the training is considered successful and the child is toilet trained.  The Noppy bedwetting alarm Especially user friendly, lightweight and just as compact as a watch. It can be worn on either the left or right wrist and the child's own underwear can be used during this training.  How does the Noppy bedwetting alarm work? The bedwetting alarm is attached to the child's wrist. The alarm's cable is then clicked into the child's underwear on the spot where the urine will reach the cloth first. When the cloth between two sensors becomes wet, they will react and cause the bedwetting alarm to sound off an alarm tone, waking up the child.  Child's motivation It is important that the user of the alarm (the child) is motivated to conjure up the discipline needed to work with this method. You can increase the child's motivation by training in a playful manner - using the supplied covers for the alarm. These come in the shape of a bear, a butterfly and a ladybug.  Safety The Noppy bedwetting alarm is an advanced device that makes use of miniature electronics. The currents being used in the sensors to measure the humidity are extremely low and therefore absolutely safe. The Noppy also adheres to all needed medical standards.   Technical information Power supply  : 3V battery type CR1632 Especially user friendly, lightweight and compact.  Can be worn on either the left or right wrist.  No extra costs for special underwear; you can use the child’s own underwear.  Quality The Noppy is manufactured in Ireland to high quality standards, and the unit is designed to withstand wear and tear. The manufacturers have many years of experience in the healthcare sector and the Noppy has been refined to result in a quality device that works! CE marked","http://www.healthcare4all.co.uk/Therapy/Noppy+Bed-Wetting+Enuresis+Alarm.html","http://www.healthcare4all.co.uk/images/Noppy-Enuresis-Alarm_sm.jpg","29.94","Therapy","Y","588"
"Adult Limb Clamp ECG Electrodes (set of 4)","Other","Suitable for Prince 180D monitor","958","V0012M-I AdultClamp ECG Ag/AgCI electrode- Suitable for Heal Force Prince 180D Handheld ECG Monitor- perfect fit for 3.0mm Din plug or 0.156-in.(4mm) banana plug or (4mm) Snap leadwires- Metal Electrodes: Ag/AgCl- 1 set of 4 electrodes- Colour coding standard: IEC, red(R), yellow(L), black(RF), green(F) - CE marked","http://www.healthcare4all.co.uk/ECG+Monitors/Adult+Limb+Clamp+ECG+Electrodes+%28set+of+4%29.html","http://www.healthcare4all.co.uk/images/Adult Limb Clamp ECG Electrodes_sm.jpg","29.40","ECG Monitors","Y","589"
"Aquacel AG Silver Hydrofiber Ribbon Dressing 1cm x 45cm (x5)","Convatec","","959","AQUACEL® Ag dressing incorporating unique Hydrofiber® Technology with 1.2% (w/w) ionic silver combines the favourable gelling characteristics of Hydrofiber® Technology with the broad-spectrum antimicrobial properties of ionic silver (Ag+). It is a versatile primary dressing indicated for use on moderately and highly exuding chronic and acute wounds where there is an infection or an increased risk of infection when used in a comprehensive protocol of care.   420128 Ribbon form, with stitchbonding for added strength - 1 x 45cm 5 per box","http://www.healthcare4all.co.uk/First+Aid+%252526+Dressings/Aquacel+Dressings/Aquacel+AG+Silver+Hydrofiber+Ribbon+Dressing+1cm+x+45cm+%28x5%29.html","http://www.healthcare4all.co.uk/images/Aquacel_Dressing_Ribbon_sm.jpg","26.72","Aquacel Dressings","Y","590"
"OneTouch Vita Diabetic Glucose Test Strips (x50)","Johnson & Johnson","","960","Suitable for the OneTouch Vita Blood Glucose Monitoring System Pack of 50 strips Fast test time - 5 seconds End fill test strip automatically draws in blood Touchable strips","http://www.healthcare4all.co.uk/Diabetic+Equipment/Test+Strips/OneTouch+Vita+Diabetic+Glucose+Test+Strips+%28x50%29.html","http://www.healthcare4all.co.uk/images/OneTouch_Vita_Test_Strips_sm.jpg","27.12","Test Strips","Y","591"
"Respironics SideStream Plus Expiratory Filter Kit + 10 Filters","Respironics (Philips)","","961","Expiratory filter holder and filter pads for SideStream Plus and VentStream breath-enhanced nebulisers.  The expiratory filter pad is disposable and should be discarded after every treatment.  Included in pack: 1 x filter holder 10 x filter pad","http://www.healthcare4all.co.uk/Nebuliser+Accessories/Respironics+SideStream+Plus+Expiratory+Filter+Kit+%25252B+10+Filters.html","http://www.healthcare4all.co.uk/images/Sidestream_Plus_Filter_Kit_1091917_sm.jpg","21.60","Nebuliser Accessories","Y","592"
"Respironics SideStream Year Pack Adult Mask","Respironics (Philips)","","962","Includes all that you require for up to 12 months of nebuliser therapy.  A SideStream nebuliser year pack includes:  1 x SideStream reusable nebuliser drug container 1 x Adult aerosol face mask 1 x Duratube straight driveline tubing  SideStream year packs are compatible with the Porta-neb, InspirationElite and Freeway Elite compressor systems.  The air inlet filter must be replaced once every three months. If you require replacement air inlet filters, please select the appropriate pack for your nebuliser compressor system below.","http://www.healthcare4all.co.uk/Nebuliser+Accessories/Respironics+SideStream+Year+Pack+Adult+Mask.html","http://www.healthcare4all.co.uk/images/Sidestream-Reusable-Kit-Mask-Version-1223A_sm.jpg","23.40","Nebuliser Accessories","Y","593"
"Allevyn Gentle Adhesive Dressings 10cm x 10cm (x10) 66800248","Smith & Nephew","","963","ALLEVYN Gentle Gel Adhesive Hydrocellular Foam Dressing  Indications Chronic and acute exudative wounds Full and partial thickness wounds such as pressure ulcers Leg ulcers Diabetic foot ulcers Infected wounds Malignant wounds Surgical wounds First and second degree burns Donor sites Skin tears Fungating ulcers  ALLEVYN Gentle is suitable for use on fragile skin  Features Advanced triple-layered construction Absorbent hydrocellular pad Perforated soft gel adhesive wound contact layer Highly permeable waterproof outer film  Benefits Enhanced performance ALLEVYN Triple-action technology absorbs, retains, and transpires exudate to provide optimal fluid management Maintains optimal moisture balance Provides an optimal moist wound environment for the promotion of faster healing Comes off lightly Gentle adhesive allows less painful dressing changes Easier application Gel adhesive holds the dressing in place during the application of secondary retention for convenient “3rd-hand” application Cost-effective Long wear time = fewer dressing changes","http://www.healthcare4all.co.uk/First+Aid+%252526+Dressings/Allevyn+Dressings/Allevyn+Gentle+Adhesive+Dressings+10cm+x+10cm+%28x10%29+66800248.html","http://www.healthcare4all.co.uk/images/Allevyn_Gentle_sm.jpg","43.92","Allevyn Dressings","Y","594"
"Philips Avent Single Electric Natural Breast Pump SCF332/01","Philips","No.1 recommended pump by mums","964","When you are comfortable and relaxed, your milk flows more easily. That's why we  created our most comfortable breast pump yet: Sit comfortably with no need to lean  forwards and let our soft massage cushion gently stimulate your milk flow.  Features More comfortable pumping position due to unique design Choose your most comfortable setting Features a gentle stimulation mode and 3 pumping settings Gently stimulates natural let down and milk flow Soft massage cushion with warm feel Easy to combine breast and bottle feeding Includes our Natural bottle and teat for natural latch on Compact lightweight design Intuitive assembly. Easy visual matching of parts Compatible with other Philips AVENT feeding products Easy cleaning due to the small number of separate parts Easy operation at the touch of a button  What is included Breast pump body: 1 pcs Base unit incl. tubing: 1 pcs Standard-size cushion: 1 pcs Natural bottle 4 oz: 1 pcs Extra soft Newborn Flow Teat: 1 pcs Travel cover: 1 pcs Sealing disc for milk storage: 1 pcs Breast pad sample packs: 2 (2 Day pads and 2 Night pads) pcs Spare diaphragm: 1 pcs","http://www.healthcare4all.co.uk/Baby+%252526+Maternity/Philips+Avent+Single+Electric+Natural+Breast+Pump+SCF332%25252F01.html","http://www.healthcare4all.co.uk/images/AV837N_sm.jpg","115.02","Baby & Maternity","Y","595"
